ID,Content
1227,川普一直要求聯準會降息，也常抱怨美元太強，但若是聯準會真的再降息，寬鬆政策會有助改善美國經濟成長，而這會是美元進一步支撐，又跟川普想要的結果不一樣。目前，期貨交易員都加碼人民幣兌美元還會進一步走弱。面對人民幣的貶勢，中國人行本周也信心喊話，表示會繼續維護外匯市場平穩運作，人民幣周四 (8 日) 也隨之回穩，收盤報 7.0466 元，較前一交易日回升 0.19%。但從貨幣期貨價格觀察，交易員都押注更多籌碼認為人民幣未來 3 個月會繼續貶值。
1228,為迎接數位金融時代來臨，元大金控 (2885-TW) 今 (6) 日宣布，廣召儲備幹部 (MA)，預計招募 20 位 MA 生力軍，策略長暨發言人陳修偉表示，元大金挾投信、期貨、證券龍頭地位，加上依照志願分發部門 2 大優勢，且起薪就達 6 萬，高於一般行員一倍，每年 MA 招募都收到超過 1200 封履歷表，但平均錄取率僅約 1.6%，顯示元大金 MA 職缺搶破頭。張曉耕表示，元大金的 MA 還有另外一大優勢，有別於其他金控，海外據點大多是銀行為主，做的都是台商的生意，元大金挾投信、期貨、證券龍頭地位，海外據點以證券為主體，做的就是當地人的經紀業務，因此更具挑戰性，可以學習到更多、更快速充實各方面專業能力，且擁有更寬廣的發展機會。
1229,台指期今 (3) 日開盤 1 分鐘閃崩逾 500 點，期交所否認為「胖手指」的芭樂單，每筆單都是有效成交價，主要是開盤後成交價及委託價持續下跌，致台股期貨動態價格機制的基準價隨之下移；因為瞬間下跌，動態價格穩定措施也發揮作用，共產生超過 8 萬筆委託退單。台指期今 (3) 日開盤 1 分鐘閃崩逾 500 點，期交所否認為「胖手指」的芭樂單，每筆單都是有效成交價，主要是開盤後成交價及委託價持續下跌，致台股期貨動態價格機制的基準價隨之下移；因為瞬間下跌，動態價格穩定措施也發揮作用，共產生超過 8 萬筆委託退單。台指期今天 8 點 45 分開盤以 10735 點開出，但 8 點 46 分瞬間暴跌超過 500 點，最低跌到 10202 點，市場上程式單失誤遭獵殺、「胖手指」芭樂單的消息四竄，但是期交所了解後，重申非「胖手指」的芭樂單。期交所表示，今天交易系統運作一切正常，經查 8 時 46 分出現 500 餘點跌幅，是因今日開盤後成交價及委託價持續下跌，致台股期貨動態價格機制的基準價隨之下移。期交所進一步分析，台股期貨動態價格基準價於 8 時 46 分 01 秒自 10700 餘點持續下跌，8 時 46 分 07 秒跌至 10500 餘點，並持續至 8 時 46 分 09 秒；8 時 46 分 09 秒時，較大買賣委託進入，成交價及委託價下移至 10300 點上下，台股期貨動態價格機制的基準價因而下移至約 10300 點，該時點的買賣成交價落於此價位附近，故形成較大跌點。自 8 時 46 分 15 秒成交價及委託價逐步上升，約 8 時 46 分 19 秒，成交價及委託價回升 10670 點附近。期交所強調，因為瞬間下跌，動態價格穩定措施依正常機制運作也發揮了效用，台股期貨、小型台指期貨及台指選擇權等，共 8 萬餘筆委託退單。因台股期貨基準價變動，台指選擇權基準價的理論模型參數參採台股期貨基準價，故台指選擇權基準價同步變動。期交所強調，因為瞬間下跌，動態價格穩定措施依正常機制運作也發揮了效用，台股期貨、小型台指期貨及台指選擇權等，共 8 萬餘筆委託退單。因台股期貨基準價變動，台指選擇權基準價的理論模型參數參採台股期貨基準價，故台指選擇權基準價同步變動。期交所強調，因為瞬間下跌，動態價格穩定措施依正常機制運作也發揮了效用，台股期貨、小型台指期貨及台指選擇權等，共 8 萬餘筆委託退單。因台股期貨基準價變動，台指選擇權基準價的理論模型參數參採台股期貨基準價，故台指選擇權基準價同步變動。
1230,期貨走勢台指期週四上漲 41 點至 9860 點。價差方面，台指期逆價差縮至 - 17.12 點，電子期逆價差縮至 - 0.53 點，金融期轉為逆價差 - 2.41 點。現貨部分，三大法人買超 23.86 億元；而在台指期淨部位方面，三大法人淨多單增加 4544 口至 26740 口，其中外資多單加碼且空單減碼，淨多單增加 3442 口至 51696 口；十大交易人中的特定法人全月份台指期淨多單增加 1737 口至 23807 口。選擇權分析週選擇權未平倉最大量支撐壓力區由昨日 9300~10000 縮至 9600~10000 點。全月份未平倉量 put/call ratio 值由 1.32 降至 1.29，籌碼面偏多架構略為降溫。買權平均隱含波動率由 11.91% 降至 11.53%，賣權平均隱含波動率由 15.83% 降至 15.21%，買賣權皆降，而 VIX 指數下降 0.58 至 14.47，創 2018 年 10 月 3 日以來新低，整體顯示選擇權市場氛圍樂觀。   (永豐期貨研調)週選擇權未平倉最大量支撐壓力區由昨日 9300~10000 縮至 9600~10000 點。全月份未平倉量 put/call ratio 值由 1.32 降至 1.29，籌碼面偏多架構略為降溫。買權平均隱含波動率由 11.91% 降至 11.53%，賣權平均隱含波動率由 15.83% 降至 15.21%，買賣權皆降，而 VIX 指數下降 0.58 至 14.47，創 2018 年 10 月 3 日以來新低，整體顯示選擇權市場氛圍樂觀。   (永豐期貨研調)本投資研究報告由永豐期貨股份有限公司版權所有，未經授權，禁止轉載節錄。本資料內容僅供參考，客戶應審慎考量本身之需求與投資風險，本公司恕不負任何法律責任，亦不作任何保證。
1231,整體來看，法人指出，昨日外資現貨部位再度轉為賣超 71.9 億元，期貨淨多單則減碼 3051 口至 46684 口，看多的態度再多鬆動，反映美中貿易戰的不確定性，以及全球經濟放緩壓力預期，目前市場氛圍有轉趨關注聯準會 (FED) 政策動向的態勢。
1232,《台指期走勢分析》台股觀點：美國延長華為禁令寬限期 90 天，美股科技及半導體類股再度大漲，激勵週二台股 IC 設計、光通訊族群走高，雖然聯發科漲多拉回，同時金融股在富邦及國泰金領跌下表現疲弱，使得指數早盤呈現開高走低態勢，不過大立光止跌反彈，同時台積電也有近 1% 的漲幅，支撐指數收盤上漲 0.32%；整體來看，雖貿易代表署宣佈針對部分商品延後關稅之課徵，不過 Apple 部分銷售成長幅度較高之商品，如：AirPods 和 AppleTV 仍包括在 9 月 1 日的關稅課徵清單之中，此次關稅課徵仍將顯著對台灣相關產業造成衝擊，另外，近期美國通膨及就業數據優異，FEDWatch 顯示市場已經調整 FED 降息次數據期，在美元指數強勢及後續貿易衝突升溫情況仍然存在下，仍需多加留意台幣貶值及外資之賣超狀況是否出現擴大，在市場不確定性偏高下，投資人宜多利用台指期貨規避下檔風險。台股觀點：美國延長華為禁令寬限期 90 天，美股科技及半導體類股再度大漲，激勵週二台股 IC 設計、光通訊族群走高，雖然聯發科漲多拉回，同時金融股在富邦及國泰金領跌下表現疲弱，使得指數早盤呈現開高走低態勢，不過大立光止跌反彈，同時台積電也有近 1% 的漲幅，支撐指數收盤上漲 0.32%；整體來看，雖貿易代表署宣佈針對部分商品延後關稅之課徵，不過 Apple 部分銷售成長幅度較高之商品，如：AirPods 和 AppleTV 仍包括在 9 月 1 日的關稅課徵清單之中，此次關稅課徵仍將顯著對台灣相關產業造成衝擊，另外，近期美國通膨及就業數據優異，FEDWatch 顯示市場已經調整 FED 降息次數據期，在美元指數強勢及後續貿易衝突升溫情況仍然存在下，仍需多加留意台幣貶值及外資之賣超狀況是否出現擴大，在市場不確定性偏高下，投資人宜多利用台指期貨規避下檔風險。
1233,歐盟各國領袖日前「有條件」同意，英國可延後脫歐期限，若英國首相梅伊修改後的脫歐協議，獲國會表決通過，脫歐期限可延至 5 月 22 日；今 (22) 日歐股盤前，指數期貨漲跌互見。台北時間週五下午 3 點 12 分，Investing.com 報價顯示，歐洲 Stoxx 50 指數期貨下跌 0.15%，英國 FTSE 100 指數期貨下跌 0.32%，德國 DAX 指數期貨下跌 0.14%，法國 CAC 40 指數期貨上漲 0.35%。
1234,外資現貨買超 55 億，期貨淨多單略縮至 56702 口。自營商選擇權淨部位，目前以買買權和賣賣權作布局。四月選擇權籌碼呈現中性偏多格局，賣權 OI 大於買權 OI 之差距為三萬四千餘口，買權賣權 OI 增量皆無表態。週選方面，買權賣權 OI 總量相當，目前多空互不相讓。外資現貨買超 55 億，期貨淨多單略縮至 56702 口。自營商選擇權淨部位，目前以買買權和賣賣權作布局。四月選擇權籌碼呈現中性偏多格局，賣權 OI 大於買權 OI 之差距為三萬四千餘口，買權賣權 OI 增量皆無表態。週選方面，買權賣權 OI 總量相當，目前多空互不相讓。綜合以上，外資期現貨同步偏多，自營商選擇權中性偏多格局，月、週選中性偏多，整體籌碼面中性偏多格局。技術面台股月 K 棒上檔面臨月線壓力，但在目前下檔支撐逐漸墊高下，台股短線的拉回依舊仍可逢低偏多布局。
1235,許多人喜歡抓轉折點，尤其是期貨投資人，明明只有 200 點的空間，卻總希望可以高空低補，同時又反手做多，讓 200 點的空間變成 1 千點。其實這個想法不能說他錯，畢竟任何人做任何投資，總是會希望利潤最大化。問題是投資人有沒有想過一個問題？如果行情明明是空頭，你也知道要放空。但你卻逆勢做多，結果在空頭市場不理性的市場氣氛下，指數又不理性的下跌了，這時候你的多頭部位怎麼辦？反手再空？白白浪費一段該賺沒賺的行情。加碼做多？結果再跌搞到賺錢變賠錢，明明看空，也明明可以一路抱到大賺，卻偏要自作聰明去做多，結果搞到自己賺變賠，這真的是「聰明反被聰明誤」，反而是傻傻的一單抱到底，二百點全都吃到還比較聰明，不是嗎？
1236,週三 (8 日) 美國國防部證實，伊朗向駐伊拉克的「多個」美軍基地，發射十幾枚彈道導彈，報復行動一波波的消息傳出，道瓊期貨應聲暴跌逾 400 點。
1237,群益期貨自媒體官網：https://media.capitalfutures.com.tw/index
1238,"1. 因美股持續高檔震盪，晨間亞洲股市普遍拉回修正。周三台股在金融股持續轉強，加權早盤以小跳高開出，盤中 PCB、光學、自行車、風電等族群走強，支撐指數維持在平盤之上窄幅震盪，尾盤因期貨結算拉動 2330 台積電，終場指數收 10,551.56 點，漲幅 0.37%。"
1239,日本金融期貨協會 (FFAJ) 已警告因假期造成的流動性真空，市場可能不穩，增添避險情緒，拖累美元兌日圓在 108.88 高點賣壓沉重。美國商品期貨交易委員會 (CFTC) 數據顯示，最近一周投機客美元淨多倉降至 11 月 12 日以來最低，暗示美元或許仍有下跌空間。
1240,隨著美國道瓊期貨反彈，及陸港股止穩，台股加權指數今 (7) 日一度漲百點，站回 11000 點關卡上，最高來到 11004.76 點，終場以 10987.14 點作收，上漲 90.02 點，漲幅 0.83%，成交值略縮至 1117 億元，法人指出，指數拉回仍有承接量能，加上下方月季線持續墊高，拉回空間有限。
1241,群益期貨自媒體官網：https://media.capitalfutures.com.tw/index
1242,外資現貨賣超 37 億，期貨淨多單增加至 57008 口。自營商選擇權淨部位，目前仍以賣買權為主要布局，並在期貨呈現大量淨空單。五月選擇權籌碼呈現中性格局，賣權 OI 大於買權 OI 之差距為二萬七千餘口，買權賣權 OI 增量呈現相當，目前多空出現拉鋸互不相讓。外資現貨賣超 37 億，期貨淨多單增加至 57008 口。自營商選擇權淨部位，目前仍以賣買權為主要布局，並在期貨呈現大量淨空單。五月選擇權籌碼呈現中性格局，賣權 OI 大於買權 OI 之差距為二萬七千餘口，買權賣權 OI 增量呈現相當，目前多空出現拉鋸互不相讓。
1243,三大法人今日僅投信站在買方，外資、自營商賣超台股，期貨部分，外資今日小幅增加多單 564 口，多單未平倉口數達 4.76 萬口，投信也減碼 1277 口空單，空單未平倉口數降到 2.98 萬口，自營商則增持空單，空單未平倉口數達 2205 口。
1244,"觀察今天 ""大盤委賣張數"" 和昨天的數據差不多，賣壓依舊偏重，成交量則是萎縮至千億以下，就正常情況而言不太容易撐得住盤勢，更何況是在亞股回檔的偏空氛圍之下。台股今天這種逆著國際盤的走法和上週三頗為類似，因此不排除是受到週選擇權結算刻意撐盤的干擾。今日大盤賣壓仍然較重，期貨和 OTC 指數也不見率先轉強的跡象，所以在正式滾量之前，台股以緩步盤高（類似進三退一二）節奏行進的機率較高，在昨日 ""大盤向上缺口""（10269~10294）沒回補前，都保有往上推升的動能。"
1245,資金行情旺盛，4 日台灣股匯齊揚，大盤收長紅 K 棒，日線連二紅，續創逾 29 年新高，日量增加逾 17%，技術面持續火熱。籌碼方面，三大法人同步買超，其中外資僅 16 日買超，期貨部位亦偏多操作。傳中國再購 13.2 萬噸美國大豆，中美貿易戰進一步緩和，美方稱美國企業很快就會拿到向華為供貨的許可證。考量多數企業財報優於預期，美中談判趨於樂觀，技術及籌碼面亦正向發展，預期台股仍有向上潛力，選股方面，可留意低本益比、財報表現佳族群波段操作。
1246,市場靜待美國聯準會 (Fed) 利率決策，預期 Fed 將降息 1 碼，今 (30) 日歐股盤前，指數期貨漲跌互見。台北時間週二下午 2 點 34 分，Investing.com 報價顯示，歐洲 Stoxx 50 指數期貨上漲 0.06%，英國 FTSE 100 指數期貨上漲 0.23%，德國 DAX 指數期貨下跌 0.08%，法國 CAC 40 指數期貨下跌 0.19%。
1247,"◇期貨市場:台指期上漲 2 點或 0.02%，收在 10592 點。電子期上漲 2.25 點或 0.54%。金融期下跌 19.8 點或 1.52%。非金電期下跌 19 點或 0.15%。台指期未平倉餘額，自營商偏空調整 281 口，累計為淨空單 2,205 口；投信偏多調整 1,277 口，累計為淨空單 29,853 口；外資偏多調整 563 口，累計為淨多單 47,698 口。台指期逆價差 23.66 點，價差擴大；電子期逆價差 0.80 點，價差擴大；金融期逆價差 3.73 點，價差由正轉負；非金電期逆價差 23.59 點，價差擴大。週三台指期平盤震盪，當日高低點相差僅 23 點，終場上漲 2 點作收。由Ｋ線觀察，台指期目前收盤位於多條短期均線之上，然而上檔季線施壓，形成一個上壓下撐狀態，觀察成交量與價位呈現價量背離，顯見多方撐盤力道不強，故建議投資人先以區間震盪來看待行情。"
1248,週三，直言無諱的鮑爾一如預期未再進一步升息，將聯邦基金期貨利率維持在 2.25% 至 2.50% 之間。但預料之外的是他鴿派的言論。
1249,隨後，德意志證交所旗下歐洲期貨交易所 Eurex Clearing 將充當「中央交易對手」和「代幣化機構」，而德國商業銀行並進一步在 Eurex Clearing 部署代幣化現金作為抵押品。試點過程中，MEAG 負責擔任證券買方，德國商業銀行則是擔任證券代幣的賣方和託管者。
1250,群益期貨自媒體官網：https://media.capitalfutures.com.tw/index
1251,外資現貨買超 81 億，期貨淨多單續增至 41117 口。自營商選擇權淨部位，今日以買買權和賣賣權作增量。八月選擇權籌碼呈現中性格局，買權 OI 大於賣權 OI 之差距為四千餘口，買權賣權 OI 增量呈現拉鋸。週選方面，賣權 OI 增量積極大增，目前多方往上表態。外資現貨買超 81 億，期貨淨多單續增至 41117 口。自營商選擇權淨部位，今日以買買權和賣賣權作增量。八月選擇權籌碼呈現中性格局，買權 OI 大於賣權 OI 之差距為四千餘口，買權賣權 OI 增量呈現拉鋸。週選方面，賣權 OI 增量積極大增，目前多方往上表態。
1252,台北股市今天期、現貨出現分歧，現貨有創高，期貨卻沒創高；顯然多頭信心『依舊保守』。延續我們昨天說的… 黑手並沒有因為美股的大漲，而出現心態改變。目前雖然外資期貨多單滿手，但是就近期的情況來看… 每每結算日，黑手都會壓抑外資在期貨市場的獲利。所以展望明天的台指結算，我們就不過度預期；重點還是落在何時『買盤轉強』?! 不然，本周在時間波上… 都還是有修正的風險。
1253,期交所今 (20) 日公告，十年期公債期貨、非金電選擇權、櫃買選擇權及印度 50 期貨等 4 項產品將於今 (2019) 年 9 月下市。期交所今 (20) 日公告，十年期公債期貨、非金電選擇權、櫃買選擇權及印度 50 期貨等 4 項產品將於今 (2019) 年 9 月下市。期交所表示，十年期公債期貨、非金電選擇權、櫃買選擇權及印度 50 期貨將於 9 月下市，其中，十年期公債期貨於 9 月 12 日下市，相關規章自 9 月 17 日起廢止；非金電選擇權及櫃買選擇權於 9 月 19 日下市，相關規章自 9 月 19 日起廢止；印度 50 期貨於 9 月 27 日下市，相關規章自 9 月 30 日起廢止。期交所表示，十年期公債期貨、非金電選擇權、櫃買選擇權及印度 50 期貨將於 9 月下市，其中，十年期公債期貨於 9 月 12 日下市，相關規章自 9 月 17 日起廢止；非金電選擇權及櫃買選擇權於 9 月 19 日下市，相關規章自 9 月 19 日起廢止；印度 50 期貨於 9 月 27 日下市，相關規章自 9 月 30 日起廢止。至於此 4 項產品為何下市？期貨業者表示，期交所每年均會定期檢視已上市商品，並依一定的質化及量化標準予以檢討，因為不管是期交所或是期貨業者，為了維護這些商品交易，都有一定的成本。業者分析，像非金電選擇權、櫃買選擇權兩個商品，雖然標的非金電指數、櫃買指數是投資人熟悉的標的，但推出後顯然市場仍然看重的是大盤指數的選擇權－－台指選擇權，另外，郵政儲金及壽險業者長期持有公債，公債現貨流通甚少，市場因而無公債期貨避險需求，這些因素造成這三項商品交易量少，效益有限，故在成本與效益檢討下，期交所讓這幾個商品下市。業者分析，像非金電選擇權、櫃買選擇權兩個商品，雖然標的非金電指數、櫃買指數是投資人熟悉的標的，但推出後顯然市場仍然看重的是大盤指數的選擇權－－台指選擇權，另外，郵政儲金及壽險業者長期持有公債，公債現貨流通甚少，市場因而無公債期貨避險需求，這些因素造成這三項商品交易量少，效益有限，故在成本與效益檢討下，期交所讓這幾個商品下市。至於印度 50 期貨，則因印度政府的政策，Nifty 50 指數不再授權給國外，印度國家指數公司在與期交所的授權合約到期後，即不再授權，因此印度 50 期貨現掛出存續最久的契約是 2019 年 9 月份到期契約，該月份契約在 9 月 27 日到期，印度 50 期貨商品即會下市。期交所提醒交易人，前述 4 項商品均已停止加掛新到期月份契約及新序列，非金電選擇權及櫃買選擇權 2 月到期契約於 2 月 20 日到期後，2 月 21 日將不再掛出今年 5 月到期契約，如擬利用前述 4 項商品進行各式交易，應注意商品下市時間。
1254,星展集團認為，貿易戰已非單純與貿易有關，關鍵在於美中雙方互爭戰略性技術與科技主導權，由於結構性問題短期無解，預料將拉鋸一段時間。觀察芝加哥期貨交易所波動度指數 (VIX) 上週大漲 48%，意味市場高波動的環境並未結束。
1255,美中貿易戰持續延燒，陸媒暗示，中國有意切斷對美稀土供應，市場憂心，若此事成真，兩國貿易爭端，恐再度升級；今 (30) 日歐股盤前，指數期貨走揚。台北時間週四下午 2 點 48 分，Investing.com 報價顯示，歐洲 Stoxx 50 指數期貨上漲 0.24%，英國 FTSE 100 指數期貨上漲 0.26%，德國 DAX 指數期貨上漲 0.31%，法國 CAC 40 指數期貨上漲 0.41%。
1256,"期貨走勢台指期週五下跌 0 點至 10528 點。價差方面，台指期轉為正價差 3.33 點，電子期轉為正價差 0.47 點，金融期逆價差縮至 - 0.87 點。現貨部分，三大法人賣超 26.28 億元；而在台指期淨部位方面，三大法人淨多單增加 142 口至 12027 口，其中外資空單加碼超過多單加碼，淨多單減少 298 口至 41161 口；十大交易人中的特定法人全月份台指期淨多單增加 1405 口至 7513 口。美股周四四大指數終結連二跌反彈收高，國際油價強彈帶動相關個股推升指數走高，但美股盤後博通下修財測導致盤後大跌連帶拖累週五美股電子盤開低。台指期早盤受到美股反彈帶動小幅開高，但現貨開盤後台積電受博通調降財測影響以下跌 1.5 元開出，也導致現貨直接開低加上蘋概股除鴻海外多數出現拉回帶動大盤早盤始終壓在盤下震盪，陸股開盤後迅速翻黑也拖累台股盤中反彈無力，且大盤盤中預估量能低於 800 億元更使得全日僅在狹幅區間震盪，所幸電子股壓回資金再度回流金融傳產股力撐盤勢，加權指數終場以 10,524.67 點作收，下跌 36.34 點，成交量 839.86 億元。技術面來看，周五指數日 K 連二黑且回測 10 日線支撐，日 KD 指標高檔死亡交叉向下，且近期量能在 10600 點以上反出現觀望，指數短線轉為區間震盪架構，建議短線可在季線與半年線間來回操作並嚴設停損。選擇權分析選擇權未平倉量部分，買權未平倉最大量集中在 10700 點，賣權未平倉最大量集中在 10300 點。全月份未平倉量 put/call ratio 值由 1.08 降至 1.06。VIX 指數小漲 0.07 至 14.52。更細部從 OI 狀況觀察，可以發現 Call 的 OI 在 10600、10700 的合約分別高達 3.5 萬與 3.7 萬口，也顯示月結算前此區的上檔壓力相對較重。   (永豐期貨研調)選擇權未平倉量部分，買權未平倉最大量集中在 10700 點，賣權未平倉最大量集中在 10300 點。全月份未平倉量 put/call ratio 值由 1.08 降至 1.06。VIX 指數小漲 0.07 至 14.52。更細部從 OI 狀況觀察，可以發現 Call 的 OI 在 10600、10700 的合約分別高達 3.5 萬與 3.7 萬口，也顯示月結算前此區的上檔壓力相對較重。   (永豐期貨研調)本投資研究報告由永豐期貨股份有限公司版權所有，未經授權，禁止轉載節錄。本資料內容僅供參考，客戶應審慎考量本身之需求與投資風險，本公司恕不負任何法律責任，亦不作任何保證。"
1257,美國那斯達克 100 期貨指數 (NASDAQ)30 日即將在台掛牌上市，NASDAQ 指數發言人 Rob Hughes 表示，NASDAQ 100 期貨指數納入現代化工業基礎建設、新創與新興科技等科技指標個股，代表全球創新經濟動能，未來也不排除在台推出費城半導體期貨指數。NASDAQ 30 日即將在期交所掛牌上市的 NASDAQ 100 期貨，這是 NASDAQ100 期貨首次在美國以外的市場掛牌發行，包括 NASDAQ 發言人 Rob Hughes 與 NASDAQ Dorsey Wright 研究暨客戶關係部門主管 Jay Gragnani 今 (26) 日聯袂抵台，舉行媒體說明會，介紹 NASDAQ 100 期貨指數的特點。Rob 指出，NASDAQ 100 指數期貨成分股幾乎都是科技產業的龍頭企業，包括微軟、谷歌、亞馬遜、蘋果、臉書等大型企業，產業面涵蓋新創、新興科技與現代化工業基礎建設等，比起 S&P 500 成分股摻雜部分「非純科技股」，NASDAQ 100 成分股可說是百分之百純科技類股，未來還可能因應汽車智慧化趨勢，將汽車產業陸續納入成分股。Rob 認為，科技不斷推陳出新，尤其是新創科技更是 21 世紀經濟產業新趨勢，而從 NASDAQ 100 期貨成分股來看，包括谷歌、臉書、微軟、蘋果等大型企業都名列其中，而這些產業也確實牽動人類經濟發展，因此從 NASDAQ 100 切入有助於掌握新科技經濟成長動能。Rob 進一步指出，未來也計畫在與期交所進一步合作，規劃推出費半期貨指數，並進一步延伸至費半正、反向 ETF 相關商品。
