ID,Content
0,板塊方面，本地地產及零售、內航、內房、內銀與水泥股表現較好。做空方面，佔大市成交回落至 14.6%。牛熊證街貨最新比例為 58:42，現價上下各 1000 點區間的牛熊比例仍是 45:55。重貨區方面，熊證上移至 27400-27449，牛證則上移至 26650-26699。恆指期貨夜市收報 27075 點，上升 49 點，高水 82 點。港股 ADR 上升 50 點，相等於恆指 27044 點。
1,做空方面，佔大市成交再上升至 16.4%，為 6 月的新高。牛熊證街貨最新比例為 42:58，現價上下各 1000 點區間的牛熊平例是 38:62。重貨區方面，熊證仍在 27150-27199，牛證也不變在 26600-26649。恆指期貨週四夜市收報 26808 點，下跌 40 點，低水 157 點。港股 ADR 上升 270 點，相等於恆指 27236 點。
2,英國首相梅伊希望與工黨黨魁柯賓 (Jeremy Corbyn) 協商，制定脫歐計畫，等同表態支持「軟脫歐」；今 (3) 日歐股盤前，指數期貨漲跌互見。台北時間週三下午 2 點 42 分，Investing.com 報價顯示，歐洲 Stoxx 50 指數期貨上漲 0.36%，英國 FTSE 100 指數期貨下跌 0.05 %，德國 DAX 指數期貨上漲 0.56%，法國 CAC 40 指數期貨上漲 0.69%。
3,彭博社報導，從聯邦基金期貨利率的變化來看，市場認為聯準會 7 月將決定降息，而且是完整的 1 碼。但對於 2019 全年寬鬆的程度，看法比之前來得略為保守一些；但不少交易員仍然認為，今年不會只降息一次。
4,鍾郁婕建議，操作上可運用國內唯一追蹤富時中國 A50 指數之國泰 A50(00636)、國泰 A50 正 2 (00655L) 等 ETF 參與後勢。資金有限的投資人亦可使用 ETF 期權商品，例如國泰中國 A50 ETF 期貨 (OJF) 來參與中國股市，惟從事期權操作，須留意整體風險，設定停損價位。
5,3. 就籌碼的角度來看，新台幣匯率近日連續升破兩個關卡 30.5 與 30.4，強力的升值也讓外資的買超持續，就 10 月至今外資總買超 1474 億，外資近期連 16 買創 2016 年 2 月 25 日以來最長買超紀錄，今日將挑戰 1999 年 9 月寫下的連 17 買紀錄。不過 10 月份至今投信只買超 17.7 億、自營商卻賣超 118 億元，融資增加了 87 億、融券增加 4.9 萬張，就資券變化來看融資軋空手明顯融券屢創新高也正在軋空單，接下來是外資軋空投信與自營商持股不足的現象目前也正在進行中；而外資昨天期貨多單增加 2734 口總多單來到 6.1 萬口這個口數也是創今年的新高，可見外資在匯率升值的背景下期現貨都是積極做多，這一波軋空的氣勢又在美股創歷史新高以及亞股補漲的帶動下很有機會在 20 號台指期結算前就先持續走出軋空，因此在這段軋空屢創新高的走勢下要留意的是台股是否有暴量不漲的現象發生，若有此技術面量價關係出現變化時則是外資有逢高調節獲利出場的跡象。3. 就籌碼的角度來看，新台幣匯率近日連續升破兩個關卡 30.5 與 30.4，強力的升值也讓外資的買超持續，就 10 月至今外資總買超 1474 億，外資近期連 16 買創 2016 年 2 月 25 日以來最長買超紀錄，今日將挑戰 1999 年 9 月寫下的連 17 買紀錄。不過 10 月份至今投信只買超 17.7 億、自營商卻賣超 118 億元，融資增加了 87 億、融券增加 4.9 萬張，就資券變化來看融資軋空手明顯融券屢創新高也正在軋空單，接下來是外資軋空投信與自營商持股不足的現象目前也正在進行中；而外資昨天期貨多單增加 2734 口總多單來到 6.1 萬口這個口數也是創今年的新高，可見外資在匯率升值的背景下期現貨都是積極做多，這一波軋空的氣勢又在美股創歷史新高以及亞股補漲的帶動下很有機會在 20 號台指期結算前就先持續走出軋空，因此在這段軋空屢創新高的走勢下要留意的是台股是否有暴量不漲的現象發生，若有此技術面量價關係出現變化時則是外資有逢高調節獲利出場的跡象。
6,用官方常用的語言，盤勢現在是從「極度樂觀」變為「審慎樂觀」。所以也還沒有到「悲觀」的地步。操作上如果是偏多的操作，不管是股票還是期貨，都應該以短線的心態為之。手中的持股若太多應該要趕快調整，不少中小型股已經明顯的由高檔轉弱，並不是題材消失，而是股價漲多了，先避開這一次可能的回檔後，再等待良機進場，才是現階段應有的態度，祝大家操作順利。
7,板塊方面，手機設備、半導體、5G 概念、醫藥、物管及教育股表現較好。做空方面，佔大市成交回升至約 14.4%。牛熊證街貨最新比例為 57:43，現價上下各 1000 點區間的牛熊比例也是 44:56。重貨區方面，熊證仍在 28900-28949，牛證也不變在 28300-28349。恆指期貨夜市收報 28388 點，下跌 198 點，低水 206 點。港股 ADR 下跌 227 點，相等於恆指 28367 點。
8,"縱然受到聯準會暗示今年均不升息、全球景氣惡化隱憂以及川普談話言論等利空消息，但台股仍堅持走自己的路，開高震盪走高續創波段新高，站上 10,600 點大關，寫下 5 個月新高。即便昨日期貨已結算完畢，主力偏多的心態仍未動搖，電子權值股由台積電、南亞科、鴻海及聯發科發動攻勢；而中小型股表現也相當強勢，同時在台幣持續升值下，終場台股收漲 57 點。"
9,期貨走勢台指期週五下跌 60 點至 10201 點。價差方面，台指期逆價差縮至 - 40.75 點，電子期逆價差縮至 - 1.42 點，金融期轉為正價差 0.9 點。現貨部分，三大法人賣超 116.49 億元；而在台指期淨部位方面，三大法人淨多單減少 2922 口至 24719 口，其中外資多單減碼且空單加碼，淨多單減少 2593 口至 56200 口；十大交易人中的特定法人全月份台指期淨多單減少 2928 口至 25600 口。週四美股三大指數持續下挫，引發亞股全面調節賣壓出籠，週五台股以下跌 37 點開出，盤面上權值股走勢疲弱，蘋概三王盤中跌幅均超過 1%，加上陸股開盤後重挫打擊多頭信心，快速壓低指數一度下跌逾百點回測月線關卡，不過隨後逢低買盤進場，指數未在持續破低，終場加權指數下跌 69.93 點或 0.678%，收在 10241.75 點，成交量能 1049.54 億，較前一日縮減 38.7 億。今日八大類股漲跌互見，其中以營建類股漲幅 0.43% 表現較佳，食品類股跌幅 1.35% 表現較差。今日加權指數受國際股市表現不佳衝擊量縮下跌，但回測月線有守並留長下影線，顯示下檔仍有支撐買盤力道浮現，但外資現貨持續賣超，期貨方面轉為減碼多單，短線指數為高檔震盪格局，操作上需留意風險，並持續觀察外資及國際股匯市動向。選擇權分析月選擇權未平倉量觀察，OI 最大量支撐壓力區維持在 10000~10500 點，不過 Call 的 OI 有向 10300、10400 靠攏下移跡象。全月份未平倉量 put/call ratio 值由 1.36 降至 1.27，連兩日下降。整體選擇權數據顯示偏多架構持續降溫。   (永豐期貨研調)月選擇權未平倉量觀察，OI 最大量支撐壓力區維持在 10000~10500 點，不過 Call 的 OI 有向 10300、10400 靠攏下移跡象。全月份未平倉量 put/call ratio 值由 1.36 降至 1.27，連兩日下降。整體選擇權數據顯示偏多架構持續降溫。   (永豐期貨研調)本投資研究報告由永豐期貨股份有限公司版權所有，未經授權，禁止轉載節錄。本資料內容僅供參考，客戶應審慎考量本身之需求與投資風險，本公司恕不負任何法律責任，亦不作任何保證。
10,週三，投資人密切注意貿易發展。盤前交易中，美國指數期貨走勢震盪。台北時間 20:00 道瓊指數下跌約 140 點。
11,"籌碼面部分，外資現貨賣超 70 億，期貨增加 1,600 口，淨多單升至 5.3 萬口，大額交易人與特定法人合計買進 7,340 口。週選支撐與壓力落於 10,250 至 10,350 之間，P/C Ratio 升至 1.24，整體籌碼中性偏多看待。◆ 選擇權分析"
12,"對銅需求的擔憂再次浮上枱面，蓋過了對智利礦山供應的憂慮，造成銅價出現近 6 週以來最大的跌幅。
倫敦金屬交易所 (LME) 指標期銅，在最後一輪公開叫價中下跌 1.9%，報每噸 5797 美元，為一週低點，創下 8 月 2 日以來最大單日跌幅。影響所及，上海市場 1 日開盤後，銅價也下挫約 1%。
昨 (31 日) 公布的中國製造業數據不及預期，加劇了人們對用於發電和建築的金屬銅需求的擔憂。中國約占全球銅需求量的一半，估計今年約為 2400 萬噸。
與美國曠日持久的貿易衝突，已造成中國經濟增長降溫，打壓金屬價格，近期雖有進展，但市場對北京與華盛頓能達成全面貿易協議抱持懷疑，外加商業投資疲軟可能蔓延到消費者的跡象，共同帶來市場悲觀情緒。
芝加哥經紀公司 Zaner Group 資深副總裁 Peter Thomas 表示，對整體經濟的擔憂再次浮現，一系列政治和消費問題也在宏觀前景中有所體現，這些因素合在一起打擊市場。
德國商業銀行大宗商品研究主管 Eugen Weinberg 表示，中國的數據並不樂觀，人們希望政府能夠開始採取刺激措施，因為市場情緒很薄弱。
中國 10 月製造業活動連續 6 個月萎縮，降幅超過預期，同時服務業增長放緩，因企業正面臨著近 30 年來最慢經濟增速。
此外，全球最大銅生產國智利的礦山和港口，因全國抗議活動遭遇停工。供應中斷原應是銅價利多，但週四地緣政治和經濟問題的影響仍主導市場。"
13,板塊方面，內銀、內房、本地地產、基建、澳門愽彩、手機設備表現較好。做空方面，佔大市成交又回落至約 13.8%。牛熊證街貨最新比例為 46:54，現價上下各 1000 點區間的牛熊比例為 32:68。重貨區方面，熊證仍在 27000-27099，牛證則上移至 26400-26499。恆指期貨夜市收報 26764 點，上升 5 點，低水 34 點。港股 ADR 下跌 69 點，相等於恆指 26727 點。
14,外資現貨買超 92 億，期貨淨多單大增至 47261 口。自營商選擇權淨部位，今日以買買權和賣賣權作增量。六月選擇權籌碼呈現中性格局，賣權 OI 大於買權 OI 之差距為八千餘口，買權 OI 往上履約價作翻移退守。週選方面，賣權 OI 轉作大於買權，目前下檔支撐墊高。外資現貨買超 92 億，期貨淨多單大增至 47261 口。自營商選擇權淨部位，今日以買買權和賣賣權作增量。六月選擇權籌碼呈現中性格局，賣權 OI 大於買權 OI 之差距為八千餘口，買權 OI 往上履約價作翻移退守。週選方面，賣權 OI 轉作大於買權，目前下檔支撐墊高。
15,期貨走勢台指期週二上漲 8 點至 10340 點。價差方面，台指期轉為正價差 27.69 點，電子期正價差擴至 1.43 點，金融期轉為正價差 2.62 點。現貨部分，三大法人賣超 39.27 億元；而在台指期淨部位方面，三大法人淨多單減少 1231 口至 9493 口，其中外資多單減碼且空單加碼，淨多單減少 1424 口至 42744 口；十大交易人中的特定法人全月份台指期淨多單增加 827 口至 11164 口。選擇權分析選擇權從成交量來觀察，買權集中在 10500 點，賣權集中在 10200 點。選擇權未平倉量部分，買權未平倉最大量集中在 10700 點，賣權未平倉最大量集中在 10300 點。全月份未平倉量 put/call ratio 值維持 1.07，大於中性值 1，反應籌碼面為偏多架構。買權平均隱含波動率由 13.23% 升至 13.59%，賣權平均隱含波動率由 16.08% 升至 16.14%，買賣權皆升。選擇權部位整體來看顯示為中性格局。   (永豐期貨研調)選擇權從成交量來觀察，買權集中在 10500 點，賣權集中在 10200 點。選擇權未平倉量部分，買權未平倉最大量集中在 10700 點，賣權未平倉最大量集中在 10300 點。全月份未平倉量 put/call ratio 值維持 1.07，大於中性值 1，反應籌碼面為偏多架構。買權平均隱含波動率由 13.23% 升至 13.59%，賣權平均隱含波動率由 16.08% 升至 16.14%，買賣權皆升。選擇權部位整體來看顯示為中性格局。   (永豐期貨研調)本投資研究報告由永豐期貨股份有限公司版權所有，未經授權，禁止轉載節錄。本資料內容僅供參考，客戶應審慎考量本身之需求與投資風險，本公司恕不負任何法律責任，亦不作任何保證。
16,"由於對亞洲的出口成長，美國 2018 年牛肉出口飆升至歷史最高水平，但驅動成長的動力並不包括中國在內。
貿易團體美國肉類出口聯合會 (USMEF) 發言人 Joe Schuele 表示，「我們才剛在 2017 年年中重新進入中國市場，不過一年之後我們又遇到了更高的關稅稅率，」
Joe Schuele 說道，「 中國仍然是全球成長最快的牛肉市場，我們覺得那裡有很大的潛力，但是很多障礙使它目前不能成為我們的主要市場。」
中國長達 14 年的美國牛肉進口禁令於 2017 年結束，美國牛肉產業希望它能夠吃下中國牛肉市場不斷成長的大部分市場。但到目前為止，出口一直令人失望，與北京的貿易戰更沒有助益。在 2003 年底美國發現一例狂牛症後，中國關閉了美國牛肉生產商的市場。
根據 USMEF 的統計，去年的牛肉出口額飆升至 83.3 億美元，較前一年大舉增加超過創紀錄的 10 億美元，並以美元計算成長達 15%。南韓占了成長率的一半，因為紅肉消費持續上升。
Schuele 說，「南韓絕對是塊閃亮的市場，但我們在日本、台灣、東南亞以及墨西哥等西半球市場也度過了美好的一年。」美國牛肉進入南韓的關稅稅率接近 19%，而供應市場的競爭對手，如澳洲、紐西蘭和加拿大，則面臨更高的關稅。
按數量計算，2018 年美國牛肉出口量增加 7% 至 135 萬噸，高於 2011 年的歷史最高水平。
儘管亞洲國家的消費量僅次於美國本土市場，去年美國僅向中國出口了約 6000 萬美元的牛肉。中國對美國牛肉進口的禁令導致美國失去市場，而其他主要賣家大行其道，包括澳大利亞和南美國家。
Schuele 說，「即使沒有更高的關稅，我們對中國的出口仍然只占我們全球出口的一小部分，因為我們才剛開始將產品重新引入中國。」
中國去年對美國牛肉加徵報復性關稅，稅率從 12% 提高到 37%，於 2018 年 7 月生效，使美國牛肉生產商更難在中國市場站穩腳跟。"
17,期貨走勢台指期週一上漲 74 點至 10876 點。價差方面，台指期轉為正價差 0.4 點，電子期正價差縮至 0.08 點，金融期轉為正價差 1.23 點。現貨部分，三大法人買超 74.52 億元；而在台指期淨部位方面，三大法人淨多單減少 276 口至 31098 口，其中外資空單加碼超過多單加碼，淨多單減少 1650 口至 61456 口；十大交易人中的特定法人全月份台指期淨多單增加 1184 口至 28467 口。選擇權分析全月份未平倉量 put/call ratio 值由 1.76 升至 1.8，反應籌碼面為偏多架構。雖然 OI 最大量支撐壓力區維持 10500~10900 點不變，但賣權 10800、10850 的 OI 增加幅度都在一萬口上下相對積極，VIX 指數下跌至 12.88，整體選擇權籌碼面顯示偏多格局。   (永豐期貨研調)全月份未平倉量 put/call ratio 值由 1.76 升至 1.8，反應籌碼面為偏多架構。雖然 OI 最大量支撐壓力區維持 10500~10900 點不變，但賣權 10800、10850 的 OI 增加幅度都在一萬口上下相對積極，VIX 指數下跌至 12.88，整體選擇權籌碼面顯示偏多格局。   (永豐期貨研調)本投資研究報告由永豐期貨股份有限公司版權所有，未經授權，禁止轉載節錄。本資料內容僅供參考，客戶應審慎考量本身之需求與投資風險，本公司恕不負任何法律責任，亦不作任何保證。
18,咖啡豆期貨在今年五月跌到 13 年來新低後，迫使部分農民退出生產，隨著惡劣的天氣威脅到全球最大種植國和出口國巴西的生產、價格回升，出現驚人漲勢。芝加哥 RJO 期貨高級市場策略師 Josh Graves 表示，咖啡貨貨漲幅太大、太快，現在終於拉回，短期內，已創下四年來新高的高波動率仍將維持在高檔。紐約的阿拉伯咖啡豆期貨 2019 年上漲 27%， 12 月 17 日一度高漲至每磅 1.4245 美元創下兩年來新高，隨後回跌 9% 來到每盎司 1.2965 美元。
19,期貨走勢台指期週五上漲 25 點至 10613 點。價差方面，台指期逆價差擴至 - 26.07 點，電子期逆價差擴至 - 1.04 點，金融期逆價差縮至 - 2.3 點。現貨部分，三大法人買超 29.01 億元；而在台指期淨部位方面，三大法人淨多單減少 2619 口至 29320 口，其中外資多單減碼且空單加碼，淨多單減少 4281 口至 59221 口；十大交易人中的特定法人全月份台指期淨多單減少 3135 口至 25402 口。選擇權分析週選擇權未平倉量部分，OI 最大量支撐壓力區由昨日 10500~10700 轉為 10550~10700，下檔支撐上移，不過全月份未平倉量 put/call ratio 值由 1.5 降至 1.39，主因是週買權的 OI 增加程度較強，而雖然外資仍呈現買 Call 賣 Put，但今日自營商操作方向則相反。整體選擇權籌碼面仍呈現偏多架構，但增強力道已出現放緩。   (永豐期貨研調)週選擇權未平倉量部分，OI 最大量支撐壓力區由昨日 10500~10700 轉為 10550~10700，下檔支撐上移，不過全月份未平倉量 put/call ratio 值由 1.5 降至 1.39，主因是週買權的 OI 增加程度較強，而雖然外資仍呈現買 Call 賣 Put，但今日自營商操作方向則相反。整體選擇權籌碼面仍呈現偏多架構，但增強力道已出現放緩。   (永豐期貨研調)本投資研究報告由永豐期貨股份有限公司版權所有，未經授權，禁止轉載節錄。本資料內容僅供參考，客戶應審慎考量本身之需求與投資風險，本公司恕不負任何法律責任，亦不作任何保證。
20,台股今 (12) 日由電子雙雄台積電與鴻海領軍反彈，指數開高走高，終場大漲 93.09 點，收在 11520.37 點，惟成交量縮至 1181.8 億元。三大法人方面，外資現貨連 22 買、買超 46.87 億元，惟期貨減碼淨多單 2101 口，投信則賣超 1.04 億元，自營商買超 3.26 億元，共買超 49.09 億元。其中，鴻海同樣獲外資連 22 買，共大買 56 萬張。台指期部分，外資減碼淨多單，多單未平倉口數降至 50161 口；投信回補空單 1621 口，空單未平倉口數降至 21335 口；自營商回補空單 2260 口，空單未平倉口數降至 909 口。
21,筆者身為證券及期貨雙分析師，遇過投資人的疑難雜症不少。其中不少人醉心於鑽研技術分析，這都是一種上進的表現。但在筆者來看這些研究都只停留在日線甚至小時線的級數上，但大多數的考慮層面都停留在「價」的指標上。目前所有的指標包括最普遍的 KD、MACD、RSI… 等，都是以「價」來做指標的依據。因此許多號稱能賺錢的期貨軟體，事後看都很準，但其實那都是在一個行情、波段成型後看了會很準。實際上在盤中指數跳動的當下時，他的訊號其實是會忽隱忽現的。這一秒中顯示買進，可能下一秒中又顯示賣出，這樣會參考價值嗎？投資人真該好好思考一下了！
22,美國股市於連續三天上漲後，今日受到壓力。盤前交易中，道瓊指數期貨下跌逾 160 點。
23,期貨走勢台指期週三下跌 3 點至 10520 點。價差方面，台指期逆價差縮至 - 22.7 點，電子期逆價差縮至 - 0.64 點，金融期逆價差縮至 - 0.45 點。現貨部分，三大法人賣超 11.87 億元；而在台指期淨部位方面，三大法人淨多單減少 1532 口至 24261 口，其中外資多單減碼超過空單減碼，淨多單減少 2408 口至 56391 口；十大交易人中的特定法人全月份台指期淨多單減少 2169 口至 21552 口。選擇權分析選擇權未平倉量部分，買權未平倉最大量集中在 10800 點，賣權未平倉最大量由 10200 上移至 10300 點。全月份未平倉量 put/call ratio 值由 1.23 升至 1.43，而 VIX 指數下降 0.07 至 13.35，外資在週選擇權結算後的淨部位也轉為買 Call 賣 Put。整體選擇權部位整體來看顯示為中性偏多格局。   (永豐期貨研調)選擇權未平倉量部分，買權未平倉最大量集中在 10800 點，賣權未平倉最大量由 10200 上移至 10300 點。全月份未平倉量 put/call ratio 值由 1.23 升至 1.43，而 VIX 指數下降 0.07 至 13.35，外資在週選擇權結算後的淨部位也轉為買 Call 賣 Put。整體選擇權部位整體來看顯示為中性偏多格局。   (永豐期貨研調)本投資研究報告由永豐期貨股份有限公司版權所有，未經授權，禁止轉載節錄。本資料內容僅供參考，客戶應審慎考量本身之需求與投資風險，本公司恕不負任何法律責任，亦不作任何保證。
24,美中貿易戰野火燒不盡，台股走勢也跟著上沖下洗，國票期貨仍樂觀看待台股後勢發展。股票期貨已經成為投資人，常用的避險及套利工具，不過股票期貨標的超過 200 檔，國票期貨建議，日均量超過 1 千口以上的個股期貨，是比較推薦的標的。為了活絡台灣股票期貨市場，鉅亨網舉辦為期三個月的股票期貨交易競賽，由國票期貨奪下 7 月交易成長獎，該公司也預計第四季推出促銷活動促進股票期貨交易量。由於台股近期走勢劇烈震盪，國票期貨建議投資人操作股票期貨，短線上應該偏向保守操作。
25,盤前交易中，美國指數期貨下跌約 0.2%，持續週三的下滑走勢。中美貿易關係仍為市場焦點。投資人亦等待美國公布上週初次申請失業金人數，及歐洲央行政策會議決議。
26,亞股昨日無畏美股下跌上演反彈走勢，韓股開高走高、日股由黑翻紅、陸股也一路上揚，激勵台股開低後震盪走高，再度站回季線之上，盤中漲幅雖曾收斂，但終場仍以最高點 9806 點作收，上漲 97 點，台指期結算前拉高意圖相當明顯，終場成交量回升至 1005 億元，重返千億元水準。從技術、籌碼面觀察，日、周 KD 指標持續交叉向上，且周 MACD 柱狀體可望由黑翻紅，加上外資現貨同步買超 91 億元、期貨多單同步大幅加碼 8029 口，整體部位相對偏多，有利指數短線延續波段行情，挑戰前高 9871 點，持續關注國際情勢變化與今日台指期結算、周四台積電法說的結果。亞股昨日無畏美股下跌上演反彈走勢，韓股開高走高、日股由黑翻紅、陸股也一路上揚，激勵台股開低後震盪走高，再度站回季線之上，盤中漲幅雖曾收斂，但終場仍以最高點 9806 點作收，上漲 97 點，台指期結算前拉高意圖相當明顯，終場成交量回升至 1005 億元，重返千億元水準。從技術、籌碼面觀察，日、周 KD 指標持續交叉向上，且周 MACD 柱狀體可望由黑翻紅，加上外資現貨同步買超 91 億元、期貨多單同步大幅加碼 8029 口，整體部位相對偏多，有利指數短線延續波段行情，挑戰前高 9871 點，持續關注國際情勢變化與今日台指期結算、周四台積電法說的結果。
