ID,Content
418,美股持續偏多格局，外資在現貨市場的賣超力道已有減輕，期貨多單未平倉口數也見到回增，有利台股止跌表現機會。11777 點是不是短期低點仍待觀察，指數短期型態依舊偏弱，年關長假也會影響買盤意願，操作上仍以短線搶反彈為建議，標的可多留意法人連買個股跟進搶價差。
419,當美國聯準會加快升息步伐，很快的，美國資本市場立刻出現低利率的「毒癮戒斷症狀」，股市、房市、匯市、期貨，乃至於貴金屬等市場煩躁、焦慮不安，每日成交價格振幅擴大，暴漲暴跌。道瓊指數可以一日慘跌千點，也曾在一日瘋漲逾千點。
420,期貨走勢台指期週五下跌 3 點至 10744 點。價差方面，台指期正價差擴至 31.01 點，電子期正價差擴至 1.24 點，金融期正價差縮至 2.74 點。現貨部分，三大法人賣超 44.43 億元；而在台指期淨部位方面，三大法人淨多單增加 5808 口至 23138 口，其中外資多單加碼且空單減碼，淨多單增加 8271 口至 57008 口；十大交易人中的特定法人全月份台指期淨多單增加 7762 口至 24244 口。選擇權分析選擇權未平倉最大量支撐壓力區由 10700~11000 點擴至 10500~11000 點，下檔支撐再度下移。全月份未平倉量 put/call ratio 值由 1.2 升至 1.21。VIX 指數則持續攀高至 18.6。而外資則是持續加碼 Buy Put 的部位。整體選擇權顯示市場避險恐慌情緒仍在上升。   (永豐期貨研調)選擇權未平倉最大量支撐壓力區由 10700~11000 點擴至 10500~11000 點，下檔支撐再度下移。全月份未平倉量 put/call ratio 值由 1.2 升至 1.21。VIX 指數則持續攀高至 18.6。而外資則是持續加碼 Buy Put 的部位。整體選擇權顯示市場避險恐慌情緒仍在上升。   (永豐期貨研調)本投資研究報告由永豐期貨股份有限公司版權所有，未經授權，禁止轉載節錄。本資料內容僅供參考，客戶應審慎考量本身之需求與投資風險，本公司恕不負任何法律責任，亦不作任何保證。
421,美股今晨收盤上揚先為台股報佳音，蘋果、AMD 引領科技股大漲，道瓊、那指和標普等三大指數續創歷史新高，而在外資已在台股期貨、現貨翻多的交易之下，證券分析師黃漢成表現，今 (10) 日的台股走勢將由權值股來主導，同時要留意各公司去年 12 月營收的發布。同時，8 日外資在期指的多單口數大增 6259 口，已有明顯翻多跡象，而昨天更增 1865 口，加上外資在台股現貨在連 7 賣之後首日轉為買超 53.59 億元，在期貨、現貨同步翻多。
422,期貨走勢台指期週一上漲 3 點至 10439 點。價差方面，台指期逆價差縮至 - 33.36 點，電子期逆價差縮至 - 1.31 點，金融期逆價差縮至 - 2.74 點。現貨部分，三大法人賣超 32.46 億元；而在台指期淨部位方面，三大法人淨多單減少 543 口至 11062 口，其中外資空單加碼超過多單加碼，淨多單減少 432 口至 33931 口；十大交易人中的特定法人全月份台指期淨多單增加 1223 口至 12286 口。選擇權分析選擇權從成交量來觀察，買權集中在 10500 點，賣權集中在 10200 點。選擇權未平倉量部分，買權未平倉最大量集中在 10900 點，賣權未平倉最大量集中在 10200 點。全月份未平倉量 put/call ratio 值由 1.09 升至 1.12。買權平均隱含波動率由 13.25% 升至 13.77%，賣權平均隱含波動率由 17.35% 降至 17.31%，買權升賣權降。選擇權部位整體來看顯示為中性格局。   (永豐期貨研調)選擇權從成交量來觀察，買權集中在 10500 點，賣權集中在 10200 點。選擇權未平倉量部分，買權未平倉最大量集中在 10900 點，賣權未平倉最大量集中在 10200 點。全月份未平倉量 put/call ratio 值由 1.09 升至 1.12。買權平均隱含波動率由 13.25% 升至 13.77%，賣權平均隱含波動率由 17.35% 降至 17.31%，買權升賣權降。選擇權部位整體來看顯示為中性格局。   (永豐期貨研調)本投資研究報告由永豐期貨股份有限公司版權所有，未經授權，禁止轉載節錄。本資料內容僅供參考，客戶應審慎考量本身之需求與投資風險，本公司恕不負任何法律責任，亦不作任何保證。
423,外資現貨賣超 0.5 億，期貨淨多單略減至 44434 口。自營商選擇權淨部位，買權賣權依舊無明顯表態。八月選擇權籌碼呈現中性格局，賣權 OI 大於買權 OI 之差距為一萬四千餘口，買權 OI 增量依舊不足。週選方面，買權賣權 OI 皆往上履約價作翻移布局，目前多方持續表態。外資現貨賣超 0.5 億，期貨淨多單略減至 44434 口。自營商選擇權淨部位，買權賣權依舊無明顯表態。八月選擇權籌碼呈現中性格局，賣權 OI 大於買權 OI 之差距為一萬四千餘口，買權 OI 增量依舊不足。週選方面，買權賣權 OI 皆往上履約價作翻移布局，目前多方持續表態。
424,你也許知道，買運彩也是一種投資方式，但許多人不知道，運彩跟股票期貨一樣，也有股價走勢圖、均線、KD、買賣點之類的技術分析，以下一個足球場中大小玩法賠率的走勢圖，分析運彩場中投注的技術操作。
425,群益期貨自媒體官網：https://media.capitalfutures.com.tw/index
426,群益期貨自媒體官網：https://media.capitalfutures.com.tw/index
427,板塊方面，光伏、火鍋、豬肉及啤酒股表現較好，宣布回購計劃的渣打（2888）也表現突出。做空方面，佔大市成交回落至 14.0%。牛熊證街貨最新比例為 59:41，現價上下各 1000 點區間的牛熊平例則是 35:65，重貨區方面，熊證仍在 30300-30349，牛證重貨區也不變在 29050-29099。恆指期貨夜市收報 29478 點，上升 10 點並低水 221 點。港股 ADR 下跌 76 點，相當於恆指 29623 點水平。
428,美國總統川普上週五宣布，美墨兩國針對遏止非法移民一事，達成協議，美國政府將「無限期暫停執行」對墨國加稅；在貿易緊張情勢降溫的情況下，今 (10) 日歐股盤前，指數期貨走揚。台北時間週一下午 2 點 45 分，Investing.com 報價顯示，歐洲 Stoxx 50 指數期貨上漲 0.47 %，英國 FTSE 100 指數期貨上漲 0.33%，法國 CAC 40 指數期貨上漲 0.48%。
429,群益期貨自媒體官網：https://media.capitalfutures.com.tw/index
430,外資現貨買超 48 億，期貨淨多單縮減至 56707 口。自營商選擇權淨部位，今日以買買權和賣賣權作增量。五月選擇權籌碼呈現偏多格局，賣權 OI 大於買權 OI 之差距為五萬四千餘口，買權 OI 增量明顯增量不足。新開週選方面，賣權 OI 總量依舊大於買權，目前下檔支撐呈現墊高。外資現貨買超 48 億，期貨淨多單縮減至 56707 口。自營商選擇權淨部位，今日以買買權和賣賣權作增量。五月選擇權籌碼呈現偏多格局，賣權 OI 大於買權 OI 之差距為五萬四千餘口，買權 OI 增量明顯增量不足。新開週選方面，賣權 OI 總量依舊大於買權，目前下檔支撐呈現墊高。
431,台股今天又再創新高，已經開始來挑戰台股最終大魔王。延續我們昨天說的… 10800-11000 是空方的最後防線，所以不難發現；在期貨市場上，出現散戶不斷『摸頭』。10800 點以上，法人多單持續大?；顯示期貨空單集中在散戶身上。下星期就是台指期結算，散戶空單已經是法人多單的嘴中肉；短線可望強攻 11000 點。台股今天又再創新高，已經開始來挑戰台股最終大魔王。延續我們昨天說的… 10800-11000 是空方的最後防線，所以不難發現；在期貨市場上，出現散戶不斷『摸頭』。10800 點以上，法人多單持續大?；顯示期貨空單集中在散戶身上。下星期就是台指期結算，散戶空單已經是法人多單的嘴中肉；短線可望強攻 11000 點。
432,國會協商人員說，他們原則上達成了協議，避免了部份政府關門。消息傳出，美國指數期貨大幅上漲。盤前交易中，道瓊指數期貨大漲約 200 點。
433,元富期貨總經理、董事長特別助理福邦期貨董事長 (兼總經理)國票證券副總經理 國票期貨副總經理群益證券資深副總裁、群益期貨副總中日綜合證券期貨部暨衍生性金融商品部協理大華期貨業務經理台灣期貨交易所期貨交易、結算、紀律委員會委員期貨公會期貨業務在職教育訓練講師證券暨期貨發展基金會期貨推廣訓練講師期貨業務員、期貨分析人員、中國期貨業務員
434,"金彝獎為國內證券期貨投信投顧業界最高榮譽獎項，由證券基金會承金融監督管理委員會指導，並在金管會證期局暨所有證券期貨周邊單位支持下舉辦，為表彰證券期貨市場之傑出人才，樹立後進學習楷模，以健全證券期貨市場的發展，金彝獎評選審核過程縝密嚴謹、獲獎不易，甚至被譽稱為證券期貨市場之奧斯卡獎，獲獎之重要性與指標性由此可見一斑。根據投信投顧公會與期貨公會，元大投信截至 2019 年 10 月，整體公募基金與 ETF 規模分別來到新台幣 5,545、4,337 億元，不僅雙雙創下資產管理業歷史新高紀錄，更是台灣唯一公募基金規模突破新台幣 5000 億元之投信業者。元大投信領先同業，締造多項第一紀錄，繼首推槓桿、反向、期貨 ETF 後，2019 年再推出元大臺灣 ESG 永續 ETF（00850）、元大台股 ETF 連結傘型基金與元大全球未來通訊 ETF(00861），有鑑於國人對於退休理財的重視，近期也規畫推出元大指享退方案，其為全方位智能退休理財服務，產品線完整、多元，並規劃多功能理財平台，每月只要新台幣 3,000 元起，小資族也可能享有自己打造投資組合之理財樂趣。"
435,期貨走勢台指期週一上漲 17 點至 10545 點。價差方面，台指期正價差擴至 14.46 點，電子期正價差擴至 1.1 點，金融期轉為正價差 1.95 點。現貨部分，三大法人賣超 28.92 億元；而在台指期淨部位方面，三大法人淨多單增加 271 口至 12298 口，其中外資多單加碼超過空單加碼，淨多單增加 2853 口至 44014 口；十大交易人中的特定法人全月份台指期淨多單減少 557 口至 6956 口。上週五道瓊與 S&P 小跌 0.07% 與 0.16%，不過由於博通下修全年營收財測，拖累半導體個股重挫，費城半導體指數跌幅 2.61%，台積電 ADR 跌幅高達 4.08%。週一在台積電跳空開低跌破年線支撐的拖累下，加權指數開盤失守 10500 點大關，不過台積電開低後隨即買盤進駐緩步收斂跌幅，加上鴻海、大立光走高，以及國泰、富邦為首的金融股都出現買單拉抬，使加權指數由黑翻紅，終場加權指數小漲 5.87 點或 0.06%，收在 10530.54 點。整體而言，今天前 50 大權值股普遍走揚，抵銷台積電 1.27% 的跌幅，但從台股的上影線也可看出上方 5 日線附近追價力道轉弱，加上本週三將是月選擇權結算，近兩日行情狹幅震盪機會較大，後續投資人可密切注意本周四 Fed 的言論是否會更明確透露降息的相關訊息。選擇權分析選擇權 OI 最大量支撐壓力區由上週五的 10300~10700 縮至 10500~10700 點。全月份未平倉量 put/call ratio 值由 1.06 升至 1.08。VIX 指數下降 0.05 至 14.47 點。外資選擇權部位同步增加 Call 與 Put 的多單，而自營商也降低偏空的選擇權部位，整體而言，選擇權部位稍微有利多方，但上檔 10600~10700 的反壓相對較重，短線較大機會呈現上有壓下有撐的整理格局。   (永豐期貨研調)選擇權 OI 最大量支撐壓力區由上週五的 10300~10700 縮至 10500~10700 點。全月份未平倉量 put/call ratio 值由 1.06 升至 1.08。VIX 指數下降 0.05 至 14.47 點。外資選擇權部位同步增加 Call 與 Put 的多單，而自營商也降低偏空的選擇權部位，整體而言，選擇權部位稍微有利多方，但上檔 10600~10700 的反壓相對較重，短線較大機會呈現上有壓下有撐的整理格局。   (永豐期貨研調)本投資研究報告由永豐期貨股份有限公司版權所有，未經授權，禁止轉載節錄。本資料內容僅供參考，客戶應審慎考量本身之需求與投資風險，本公司恕不負任何法律責任，亦不作任何保證。
436,僅管 228 連假期間，國際股市沒有太大變化；但是台股開始在賣壓宣洩下，台股逆勢收黑。特別是外資今天轉買為賣，雖然只小賣 - 5 億；不過，這也表示台股最大的多方買盤已經縮手。因此，看待目前的台股… 在外資期貨多單開始鬆動下，指數短線將有修正的風險。展望明、後二天，台股跌勢預料『小浪轉大浪』，尋求短線回檔滿足點。
437,展望下星期，台股即將面臨台指期貨結算；短線上，外資沒有理由拿石頭砸自己。因此，我們研判下星期可望『拉高結算』!!展望下星期，台股即將面臨台指期貨結算；短線上，外資沒有理由拿石頭砸自己。因此，我們研判下星期可望『拉高結算』!!
438,板塊方面，以汽車及出口股表現較好。做空方面，佔大市成交維持在約 13.3%。牛熊證街貨最新比例為 59:41，現價上下各 1000 點區間的牛熊比例為 44:56。重貨區方面，熊證仍在 28000-28049，牛證也不變在 26950-26999。恆指期貨夜市收報 27602 點，下跌 78 點，低水 49 點。港股 ADR 下跌 58 點，相等於恆指 27592 點。
439,外資現貨賣超 41 億，期貨淨多單縮減至 57418 口。自營商選擇權淨部位，目前以賣買權為主要布局。四月選擇權籌碼呈現偏多格局，賣權 OI 大於買權 OI 之差距為四萬六千餘口，買權賣權 OI 增量相去不遠。週選方面，買權 OI 總量轉作大於賣權，目前上檔壓力湧現。外資現貨賣超 41 億，期貨淨多單縮減至 57418 口。自營商選擇權淨部位，目前以賣買權為主要布局。四月選擇權籌碼呈現偏多格局，賣權 OI 大於買權 OI 之差距為四萬六千餘口，買權賣權 OI 增量相去不遠。週選方面，買權 OI 總量轉作大於賣權，目前上檔壓力湧現。綜合以上，外資期現貨同步作空，自營商選擇權中性不變，月、週選中性格局，整體籌碼面中性格局。技術面今日長黑卻未出現爆量，台股目前將在年線附近作震盪整理，短線在 2 月底支撐未破下，台股震盪偏多不變。
440,期貨走勢台指期週一上漲 75 點至 10770 點。價差方面，台指期逆價差擴至 - 30.57 點，電子期逆價差擴至 - 0.95 點，金融期逆價差縮至 - 0.28 點。現貨部分，三大法人買超 99.39 億元；而在台指期淨部位方面，三大法人淨多單增加 1730 口至 30276 口，其中外資多單加碼超過空單加碼，淨多單增加 3046 口至 62779 口；十大交易人中的特定法人全月份台指期淨多單減少 219 口至 22791 口。選擇權分析選擇權籌碼面觀察，週選 OI 最大量支撐壓力區由 10700~10800 擴至 10700~10850。全月份未平倉量 put/call ratio 值由 1.77 升至 1.82，外資、自營在選擇權操作上也都呈現同向的買 Call 賣 Put。整體選擇權部位顯示偏多架構持續增溫。   (永豐期貨研調)選擇權籌碼面觀察，週選 OI 最大量支撐壓力區由 10700~10800 擴至 10700~10850。全月份未平倉量 put/call ratio 值由 1.77 升至 1.82，外資、自營在選擇權操作上也都呈現同向的買 Call 賣 Put。整體選擇權部位顯示偏多架構持續增溫。   (永豐期貨研調)本投資研究報告由永豐期貨股份有限公司版權所有，未經授權，禁止轉載節錄。本資料內容僅供參考，客戶應審慎考量本身之需求與投資風險，本公司恕不負任何法律責任，亦不作任何保證。
441,另外根據大阪證券交易所的說法，日經 225 指數期貨的外資比例達到 83.5%，創下史上第 2 新高紀錄。
442,劉世偉指出，碳交易目前以現貨及期貨兩種交易型態為主，MaiCoin 規劃將現貨的碳權代幣化，預期碳權代幣化實現後，可望成為加密貨幣實體落地應用的最大案例，如果未來主管機關將碳代幣歸類成 STO，碳權代幣化將成 STO 第一個項目。
443,期貨走勢台指期週二下跌 37 點至 10275 點。價差方面，台指期逆價差縮至 - 30.26 點，電子期逆價差縮至 - 1.26 點，金融期轉為正價差 0.37 點。現貨部分，三大法人賣超 87.45 億元；而在台指期淨部位方面，三大法人淨多單增加 163 口至 25148 口，其中外資空單減碼超過多單減碼，淨多單增加 1625 口至 53212 口；十大交易人中的特定法人全月份台指期淨多單增加 4814 口至 21475 口。美股走勢呈現開高走低，早盤開高後賣壓湧現，道瓊一度下跌超過 410 點，所幸尾盤跌幅收斂但仍跌多漲少，亞股普遍開低帶動台指期同步走低，加上外資周一大減期貨多單，連帶現貨早盤隨著亞股跌勢一度跌破 10300 點，所幸台股盤中雖連二日拉回但預估量能約在 1000 億元左右，加上中國股市受兩會召開行情激勵續創波段新高，連帶台股盤中跌幅未見擴大，隨著整體量能萎縮台股整體呈現個股表現行情，光學鏡頭類股漲勢較為整齊相關類股在大立光與玉晶光帶動下續強，櫃買指數也在生技類股轉強帶動下跌幅收斂。終場加權指數下跌 44.62 點或 0.431%，收在 10305.26 點，成交量能 1044.86 億，較前一日縮減 366.54 億。技術面來看，周二指數一度回測 10 日線有守，但日 KD 指標正式死亡交叉向下，MACD 指標也有死亡交叉疑慮，所幸指數低檔支撐持續上移且下跌量縮，短線漲多面臨技術面修正賣壓，技術面轉為區間震盪格局。美股走勢呈現開高走低，早盤開高後賣壓湧現，道瓊一度下跌超過 410 點，所幸尾盤跌幅收斂但仍跌多漲少，亞股普遍開低帶動台指期同步走低，加上外資周一大減期貨多單，連帶現貨早盤隨著亞股跌勢一度跌破 10300 點，所幸台股盤中雖連二日拉回但預估量能約在 1000 億元左右，加上中國股市受兩會召開行情激勵續創波段新高，連帶台股盤中跌幅未見擴大，隨著整體量能萎縮台股整體呈現個股表現行情，光學鏡頭類股漲勢較為整齊相關類股在大立光與玉晶光帶動下續強，櫃買指數也在生技類股轉強帶動下跌幅收斂。終場加權指數下跌 44.62 點或 0.431%，收在 10305.26 點，成交量能 1044.86 億，較前一日縮減 366.54 億。技術面來看，周二指數一度回測 10 日線有守，但日 KD 指標正式死亡交叉向下，MACD 指標也有死亡交叉疑慮，所幸指數低檔支撐持續上移且下跌量縮，短線漲多面臨技術面修正賣壓，技術面轉為區間震盪格局。選擇權分析週選擇權未平倉量部分，買賣權 OI 最大量支撐壓力區由 10300~10450 轉為 10250~10350，壓力支撐區同步向下修正，VIX 指數升高 0.26 至 13.77。不過全月份未平倉量 put/call ratio 值維持 1.24，加上外資與特定法人的選擇權部位上仍呈現偏多操作，因此選擇權籌碼面仍呈現中性偏多架構。   (永豐期貨研調)週選擇權未平倉量部分，買賣權 OI 最大量支撐壓力區由 10300~10450 轉為 10250~10350，壓力支撐區同步向下修正，VIX 指數升高 0.26 至 13.77。不過全月份未平倉量 put/call ratio 值維持 1.24，加上外資與特定法人的選擇權部位上仍呈現偏多操作，因此選擇權籌碼面仍呈現中性偏多架構。   (永豐期貨研調)本投資研究報告由永豐期貨股份有限公司版權所有，未經授權，禁止轉載節錄。本資料內容僅供參考，客戶應審慎考量本身之需求與投資風險，本公司恕不負任何法律責任，亦不作任何保證。
444,財報季鳴槍起跑，投資人聚焦企業營收、獲利表現，市場氛圍轉趨審慎；今 (16) 日歐股盤前，指數期貨走跌。台北時間週二下午 2 點 37 分，Investing.com 報價顯示，歐洲 Stoxx 50 指數期貨下跌 0.06%，英國 FTSE 100 指數期貨下跌 0.18%，德國 DAX 指數期貨下跌 0.03%，法國 CAC 40 指數期貨下跌 0.03%。
445,外資現貨買超 50 億，期貨淨多單略減至 52332 口。自營商選擇權淨部位，目前以買買權和賣賣權作布局。十二月選擇權籌碼呈現中性格局，賣權 OI 大於買權 OI 之差距為二萬一千餘口，買權賣權 OI 增量相去不遠。週選方面，賣權 OI 大於買權差距持續擴大，目前多方逐漸表態。外資現貨買超 50 億，期貨淨多單略減至 52332 口。自營商選擇權淨部位，目前以買買權和賣賣權作布局。十二月選擇權籌碼呈現中性格局，賣權 OI 大於買權 OI 之差距為二萬一千餘口，買權賣權 OI 增量相去不遠。週選方面，賣權 OI 大於買權差距持續擴大，目前多方逐漸表態。綜合以上，外資期現貨依舊偏多，自營商選擇權中性偏多格局，月、週選呈現中性偏多態勢，整體籌碼面中性偏多格局。技術面各均線逐漸往上靠攏糾結，台股可望隨量能緩步走揚，短線的拉回仍可逢低偏多操作台股。
446,盤前交易中，美國指數期貨於接近平盤水準進行整理。
447,台股過站不停… 今天再創新高。延續我們昨天的分析… 外資期貨多單留倉來到 6.5 萬口，顯然外資鐵了心全力作；只是美中不足的地方，在於黑手心態的保守。不過對於這樣的情況，今天下半場似乎開始有了改變；上半場委賣成交都還是高達 30 萬張以上差額，但是下半場開始，買盤開始有轉強表現。顯示黑手雖然明顯轉多，但至少沒有再壓抑盤勢；因此，短線在多資的強拉下，不排除有先來回補 10/11 的『空方缺口』!!
448,這些投資人從今年政府債券的單向反彈中獲利，並且更寧願使用債券期貨進行看多交易，即使其他人懷疑今年殖利率可能會走低或甚至轉為負值。AlphaSimplex 投資組合經理 Kathryn Kaminski 表示，「在殖利率為負值的世界中，某些基本面沒有任何意義。」AlphaSimplex 是一家採用趨勢追蹤策略的管理期貨基金。Société Générale 跨資產量化研究負責人 Sandrine Ungari 指出，許多趨勢追蹤的投資人，包括商品交易顧問和期貨基金經理人，年初就開始在政府債券市場建立多頭部位，押注殖利率下降，而債券價格上漲。
449,上週已分析過內資在偷跑，連假過後要小心外資跟進動作，果然昨天外資就出現較大的調整動作，期貨淨多單大減 8381 口、現貨轉賣超 5 億元。或許表面上現貨賣超金額不高，但是外資昨日買超前三名全都是連結中國的 ETF，也就是說外資實質賣超台股的金額絕對不止如此而已。
